{
  "$schema": "./report-v2.decl.schema.json",
  "$comment": "THE single declaration of the MaxBLD lot report v2 (sections → fields, each with exactly one source). Input of scripts/analysis/report-schema.mjs (--check validates gates RS-0..RS-11 and output drift; --write renders docs/reference/maxbld-report-v2-*). GENERATED by scripts/surfaces/_schema/seed-report-v2.mjs --write from report-v2-seed/ (the reviewed proposal + the operator ruling export); change the seed rules or inputs, never this file by hand, and never the generated outputs. SPEC LINK: docs/specs/01-pipeline/124_step_standard_policy.md §5 R-HM (drafted as R-RS; operator CHAT-4, 2026-10-20: one field declaration per report surface, one source per field, a --check generator, generated outputs; docs/reports/decisions/2026-10-20-chat-batch-a.json, 2026-10-20-chat-batch-a#CHAT-4), docs/specs/02-web-admin/128_surface_standard_policy.md R-21 (one descriptor set, three renderers), R-27 (one home, generated tables), R-17 (SLOT disclosure); docs/specs/01-pipeline/78_optimal_lot_configuration.md P5.12 (closed disclosure codes).",
  "version": 1,
  "provenance": {
    "seed": "scripts/surfaces/_schema/seed-report-v2.mjs",
    "proposal": {
      "path": "scripts/surfaces/_schema/report-v2-seed/schema-v2-proposal.json",
      "version": "v2-proposal-2026-10-20",
      "sha256_16": "6827d1260661083d"
    },
    "review": "scratchpad/report-review/REVIEW.md §6",
    "seeded": "2026-10-20"
  },
  "inputs": {
    "lineage": "docs/reference/maxbld-field-lineage.json",
    "spec78": "docs/specs/01-pipeline/78_optimal_lot_configuration.md",
    "consumer_descriptor": "scripts/surfaces/parcel_product/F02/surfaces/mobile_parcel_detail.descriptor.json",
    "consumer_lookup": "src/lib/parcels/consumer-lookup.ts",
    "presentation": "scripts/surfaces/_schema/report-presentation.json",
    "rulings": "scripts/surfaces/_schema/report-v2.rulings.json"
  },
  "outputs": {
    "markdown": "docs/reference/maxbld-report-v2-schema.md",
    "json_schema": "docs/reference/maxbld-report-v2.schema.json",
    "types": "docs/reference/maxbld-report-v2.types.ts",
    "sample": "docs/reference/maxbld-report-v2.sample.json",
    "lineage_queue": "docs/reference/report-v2-lineage-queue.json"
  },
  "spec_owed": {
    "N11": "PLAN §5 N11 consumer API payload (R-10 Spec 100 amendment: the scenarios block assembled server-side)",
    "APP-RENO": "companion spec APP-RENO (REVIEW §7.1): owner input, storage, consent, recompute",
    "S-072-derivation": "a deriving spec for \"new CoA ruling nearby\" (window, radius); RF-2 / RF-6 today",
    "spec88": "Spec 88 cost lane (Q-11): per-scenario cost — each card prices its own floor area with the existing rates, after the scenario step exists"
  },
  "proposed_disclosures": [],
  "cards": [
    {
      "code": "D",
      "scenario": "detached_house",
      "kind": "new_build",
      "title": "MaxBLD Detached House",
      "status": "planned",
      "source": "lineage:scenario",
      "note": "Q-1 (decided 2026-10-20): hidden on a semi_half lot (only renovation cards there)"
    },
    {
      "code": "2",
      "scenario": "house_with_secondary_suite",
      "kind": "new_build",
      "title": "MaxBLD Detached House + Secondary Suite",
      "status": "planned",
      "source": "lineage:scenario"
    },
    {
      "code": "H",
      "scenario": "detached_houseplex",
      "kind": "new_build",
      "title": "MaxBLD Houseplex — 4 units / 6 units (label by eligibility)",
      "status": "planned",
      "source": "lineage:scenario",
      "note": "one row; dwelling_units = 4, or 6 inside the sixplex map area (gap 1, approved)"
    },
    {
      "code": "S",
      "scenario": "semi_detached_houseplex",
      "kind": "new_build",
      "title": "MaxBLD Semi Houseplex (only where the lot is half a semi)",
      "status": "planned",
      "source": "lineage:scenario",
      "disclosures": [
        "semi_party_wall"
      ],
      "note": "Q-1/Q-3 (decided 2026-10-20): S exists only where semi_half holds, and a semi_half lot shows only renovation cards, so this card is never rendered; kept declared because the lineage row exists"
    },
    {
      "code": "RA",
      "scenario": "renovation_addition",
      "kind": "renovation",
      "title": "Addition (back / up)",
      "status": "planned",
      "source": "lineage:scenario",
      "note": "Q-6 (decided): a targeted addition up or back, sized by the owner"
    },
    {
      "code": "RE",
      "scenario": "renovation_envelope_expansion",
      "kind": "renovation",
      "title": "Expand to the full envelope",
      "status": "new",
      "source": "lineage:scenario",
      "note": "Q-6 (decided): keep the house and build out to the full renovation envelope (renovation_envelope_gfa_sqm − existing GFA); a separate card from RA (a targeted addition up or back sized by the owner). In P5.1 and the lineage (bylaw-fix-1 report v2 lineage queue)."
    },
    {
      "code": "RI",
      "scenario": "renovation_interior",
      "kind": "renovation",
      "title": "Gut job (envelope unchanged)",
      "status": "planned",
      "source": "lineage:scenario"
    },
    {
      "code": "RB",
      "scenario": "renovation_basement",
      "kind": "renovation",
      "title": "Basement underpinning",
      "status": "planned",
      "source": "lineage:scenario"
    },
    {
      "code": "RF",
      "scenario": "renovation_basement_finish",
      "kind": "renovation",
      "title": "Basement renovation (no underpinning)",
      "status": "new",
      "source": "lineage:scenario",
      "note": "gap 4 (approved 2026-10-20): needs existing_basement = true and the owner basement_height_m; in P5.1 and the lineage (bylaw-fix-1 report v2 lineage queue)"
    }
  ],
  "sections": [
    {
      "id": "identity",
      "title": "Lot identity and map (header)",
      "proposal_path": "match.* / parcel.lot.*",
      "fields": [
        {
          "path": "match.address",
          "name": "address",
          "label": "Address",
          "type": "text",
          "status": "live",
          "source": "consumer:match.address",
          "render": "rendered",
          "note": "[parcelId].tsx:83"
        },
        {
          "path": "parcel.parcelId",
          "name": "parcelId",
          "label": "Municipal parcel id",
          "type": "text",
          "status": "live",
          "source": "consumer:parcel.parcelId",
          "render": "rendered",
          "note": "S-001 whitelist"
        },
        {
          "path": "parcel.lot.zone_label",
          "name": "zone_label",
          "label": "Zone label",
          "type": "text",
          "status": "proposed",
          "source": "pending:spec100_amendment:Q-7",
          "render": "rendered",
          "note": "Q-7 (decided): Spec 100 §3.2 whitelist amendment. parcels.zoning_zn_string, e.g. \"RM (f18.0; a665; u4)\" — Spec 100 §3.2 whitelist extension",
          "target": "consumer:parcel.lot.zone_label",
          "origin": "parcels:zoning_zn_string"
        },
        {
          "path": "parcel.lot.zone_class_label",
          "name": "zone_class_label",
          "label": "Zone (plain words)",
          "type": "text",
          "status": "proposed",
          "source": "pending:spec100_amendment:Q-7",
          "render": "rendered",
          "note": "Q-7 scope (decided 2026-10-20, operator chat, 2026-10-20-chat-batch-b#CHAT-11): Spec 100 §3.2 whitelist amendment. presentation map R/RD/RS/RT/RM → \"Residential Detached\" …",
          "target": "consumer:parcel.lot.zone_class_label",
          "origin": "parcels:zoning_class",
          "via": "presentation:zone_class_label"
        },
        {
          "path": "parcel.lot.exception_number",
          "name": "exception_number",
          "label": "Exception number",
          "type": "text",
          "status": "proposed",
          "source": "pending:spec100_amendment:Q-7",
          "render": "rendered",
          "note": "Q-7 scope (decided 2026-10-20, operator chat, 2026-10-20-chat-batch-b#CHAT-11): Spec 100 §3.2 whitelist amendment. parcels.exception_number; pairs with exception_not_authored",
          "target": "consumer:parcel.lot.exception_number",
          "origin": "parcels:exception_number"
        },
        {
          "path": "parcel.lot.frontage_m",
          "name": "frontage_m",
          "label": "Frontage",
          "type": "number",
          "unit": "m",
          "status": "proposed",
          "source": "pending:spec100_amendment:Q-7",
          "render": "rendered",
          "note": "Q-7 (decided): Spec 100 §3.2 whitelist amendment. parcels.frontage_m (rectangle approximation, ML-6)",
          "target": "consumer:parcel.lot.frontage_m",
          "origin": "parcels:frontage_m"
        },
        {
          "path": "parcel.lot.depth_m",
          "name": "depth_m",
          "label": "Depth",
          "type": "number",
          "unit": "m",
          "status": "proposed",
          "source": "pending:spec100_amendment:Q-7",
          "render": "rendered",
          "note": "Q-7 (decided): Spec 100 §3.2 whitelist amendment. parcels.depth_m",
          "target": "consumer:parcel.lot.depth_m",
          "origin": "parcels:depth_m"
        },
        {
          "path": "parcel.lot.is_irregular",
          "name": "is_irregular",
          "label": "Irregular lot",
          "type": "boolean",
          "status": "proposed",
          "source": "pending:spec100_amendment:Q-7",
          "render": "rendered",
          "note": "Q-7 scope (decided 2026-10-20, operator chat, 2026-10-20-chat-batch-b#CHAT-11): Spec 100 §3.2 whitelist amendment. parcels.is_irregular",
          "target": "consumer:parcel.lot.is_irregular",
          "origin": "parcels:is_irregular"
        },
        {
          "path": "parcel.lot.is_corner_lot",
          "name": "is_corner_lot",
          "label": "Corner lot",
          "type": "boolean",
          "status": "proposed",